{
  "format": "qindun-rule-bundle/v1",
  "version": "2026.10.1",
  "grade_policy": {
    "format": "qindun-grade-policy/v1",
    "confirmed_danger": {
      "severity": "critical",
      "disposition": "confirmed"
    },
    "finding_grade_caps": {
      "info": "S_PLUS",
      "low": "A",
      "medium": "B",
      "high": "C",
      "critical": "C"
    },
    "local_maximum_grade": "B"
  },
  "rules": [
    {
      "id": "QINDUN.D3.RECURSIVE_ROOT_DELETE",
      "version": "1.2.0",
      "dimension": "D3",
      "severity": "critical",
      "title": "发现破坏性根目录删除命令",
      "summary": "内容包含递归强制删除根目录或用户主目录的命令",
      "disposition": "candidate",
      "consumers": [
        "platform",
        "local"
      ],
      "flags": "IGNORECASE",
      "pattern": "\\brm\\s+-[^\\n]{0,20}r[^\\n]{0,20}f\\s+(?:/|~|\\$HOME)(?:\\s|$)"
    },
    {
      "id": "QINDUN.D3.REMOTE_PIPE_SHELL",
      "version": "1.1.0",
      "dimension": "D3",
      "severity": "critical",
      "title": "发现远程内容直接进入命令解释器",
      "summary": "内容把网络下载结果未经校验直接交给脚本解释器执行",
      "disposition": "candidate",
      "consumers": [
        "platform",
        "local"
      ],
      "flags": "IGNORECASE",
      "pattern": "\\b(?:curl|wget)\\b[^\\n|]{0,500}\\|\\s*(?:(?:ba|z|k|c|fi|da|a)?sh|python(?:3(?:\\.\\d+)?)?|node|deno|bun|perl|ruby|php|pwsh|powershell)\\b"
    },
    {
      "id": "QINDUN.D3.CREDENTIAL_EXFILTRATION",
      "version": "1.1.0",
      "dimension": "D3",
      "severity": "critical",
      "title": "发现凭据收集与外传组合",
      "summary": "内容同时读取常见凭据位置并调用网络发送能力",
      "disposition": "candidate",
      "consumers": [
        "platform",
        "local"
      ],
      "flags": "IGNORECASE|DOTALL",
      "pattern": "(?:\\.ssh/|\\.aws/credentials|\\.config/gcloud|login\\.keychain).{0,300}(?:curl|fetch\\(|requests\\.|https?://)"
    },
    {
      "id": "QINDUN.D3.HIDDEN_INSTRUCTION_CONTROL",
      "version": "1.0.0",
      "dimension": "D3",
      "severity": "high",
      "title": "发现隐藏文本控制字符",
      "summary": "文本包含可改变显示顺序或隐藏指令边界的双向控制字符",
      "disposition": "candidate",
      "consumers": [
        "platform",
        "local"
      ],
      "flags": "",
      "pattern": "[\\u202A-\\u202E\\u2066-\\u2069]"
    },
    {
      "id": "QINDUN.D3.POWERSHELL_DOWNLOAD_EXECUTION",
      "version": "1.2.0",
      "dimension": "D3",
      "severity": "critical",
      "title": "发现 PowerShell 下载后直接执行",
      "summary": "网络下载结果未经校验直接交给 PowerShell 表达式执行器",
      "disposition": "candidate",
      "consumers": [
        "platform",
        "local"
      ],
      "flags": "IGNORECASE|DOTALL",
      "pattern": "(?:\\b(?:iwr|Invoke-WebRequest|irm|Invoke-RestMethod)\\b[^\\n|]{0,500}\\|\\s*(?:iex|Invoke-Expression)\\b|(?:iex|Invoke-Expression)\\s*\\(.{0,300}(?:DownloadString|Invoke-WebRequest))"
    },
    {
      "id": "QINDUN.D3.REVERSE_SHELL",
      "version": "1.1.0",
      "dimension": "D3",
      "severity": "critical",
      "title": "发现反向命令连接特征",
      "summary": "代码包含把命令解释器连接到外部网络端点的典型组合",
      "disposition": "candidate",
      "consumers": [
        "platform",
        "local"
      ],
      "flags": "IGNORECASE|DOTALL",
      "pattern": "(?:\\bbash\\s+-i\\s+[^\\n]{0,120}/dev/tcp/|\\bnc(?:at)?\\b[^\\n]{0,120}\\s-e\\s+(?:/bin/)?(?:ba)?sh\\b|socket\\..{0,300}(?:dup2|/bin/(?:ba)?sh))"
    },
    {
      "id": "QINDUN.D3.PERSISTENCE_COMMAND",
      "version": "1.0.0",
      "dimension": "D3",
      "severity": "high",
      "title": "发现系统持久化命令",
      "summary": "内容尝试通过计划任务、系统服务或启动项保持长期运行",
      "disposition": "candidate",
      "consumers": [
        "platform",
        "local"
      ],
      "flags": "IGNORECASE",
      "pattern": "(?:\\b(?:echo|printf)\\b[^\\n]{0,160}\\|\\s*crontab\\b|\\bsystemctl\\s+enable\\b|\\blaunchctl\\s+(?:load|bootstrap)\\b|\\breg\\s+add\\s+[\"']?HK(?:CU|LM)\\\\[^\\n]{0,160}\\\\CurrentVersion\\\\Run)"
    },
    {
      "id": "QINDUN.D3.OBFUSCATED_EXECUTION",
      "version": "1.0.0",
      "dimension": "D3",
      "severity": "high",
      "title": "发现解码后动态执行代码",
      "summary": "内容把动态解码结果交给代码执行函数，需要复核真实载荷",
      "disposition": "candidate",
      "consumers": [
        "platform",
        "local"
      ],
      "flags": "IGNORECASE|DOTALL",
      "pattern": "(?:base64\\.b64decode|atob\\s*\\(|Buffer\\.from\\().{0,300}\\b(?:eval|exec)\\s*\\("
    },
    {
      "id": "QINDUN.D7.PROMPT_OVERRIDE_INSTRUCTION",
      "version": "1.0.0",
      "dimension": "D7",
      "severity": "medium",
      "title": "发现疑似提示词越权指令",
      "summary": "文档尝试要求智能体忽略上级指令、系统消息或安全规则",
      "disposition": "candidate",
      "consumers": [
        "platform",
        "local"
      ],
      "flags": "IGNORECASE",
      "pattern": "(?:ignore|disregard|override)\\s+(?:all\\s+)?(?:previous|prior|system|developer|safety)(?:\\s+(?:system|developer|safety))?\\s+(?:instructions?|messages?|rules?)|忽略(?:此前|之前|以上|系统|开发者|安全).{0,16}(?:指令|消息|规则|要求)"
    },
    {
      "id": "QINDUN.D7.PROMPT_SECRET_EXFILTRATION",
      "version": "1.2.0",
      "dimension": "D7",
      "severity": "high",
      "title": "发现提示词敏感信息外传指令",
      "summary": "文档要求收集系统提示词、开发者消息或凭据并发送到外部",
      "disposition": "candidate",
      "consumers": [
        "platform",
        "local"
      ],
      "flags": "IGNORECASE|DOTALL",
      "pattern": "(?:\\b(?:collect|read|reveal|extract)\\b|窃取|读取|收集|泄露)[^|]{0,80}(?:system prompt|developer message|credentials?|secrets?|系统提示词|开发者消息|凭据|密钥)[^|]{0,160}(?:\\b(?:send|upload|post)\\b|exfiltrat|发送|上传|外传)"
    },
    {
      "id": "QINDUN.D5.PRIVATE_KEY",
      "version": "1.1.0",
      "dimension": "D5",
      "severity": "critical",
      "title": "发现私钥内容",
      "summary": "内容包含常见私钥文件头",
      "disposition": "candidate",
      "consumers": [
        "local"
      ],
      "flags": "",
      "pattern": "-----BEGIN (?:RSA |EC |OPENSSH )?PRIVATE KEY-----"
    },
    {
      "id": "QINDUN.D5.GENERIC_SECRET",
      "version": "1.2.0",
      "dimension": "D5",
      "severity": "high",
      "title": "发现疑似硬编码密钥或令牌",
      "summary": "内容包含常见密钥字段和较长的固定值",
      "disposition": "candidate",
      "consumers": [
        "local"
      ],
      "flags": "IGNORECASE",
      "pattern": "(?:api[_-]?key|access[_-]?token|auth[_-]?token|client[_-]?secret|password)\\s*[:=]\\s*[\"']?(?!(?:YOUR_(?:API_KEY|ACCESS_TOKEN|AUTH_TOKEN|CLIENT_SECRET|PASSWORD)|REPLACE_ME|CHANGEME|EXAMPLE_(?:API_KEY|TOKEN|PASSWORD))(?=[\"'\\s,;}\\]]|$))[A-Za-z0-9_./+=-]{12,}[\"']?(?=[\"'\\s,;}\\]]|$)"
    },
    {
      "id": "QINDUN.D5.AWS_ACCESS_KEY",
      "version": "1.0.0",
      "dimension": "D5",
      "severity": "high",
      "title": "发现疑似 AWS 访问密钥",
      "summary": "内容包含符合 AWS 访问密钥编号格式的固定值",
      "disposition": "candidate",
      "consumers": [
        "local"
      ],
      "flags": "",
      "pattern": "\\b(?:AKIA|ASIA)[0-9A-Z]{16}\\b"
    },
    {
      "id": "QINDUN.D5.GITHUB_TOKEN",
      "version": "1.0.0",
      "dimension": "D5",
      "severity": "high",
      "title": "发现疑似 GitHub 访问令牌",
      "summary": "内容包含符合 GitHub 令牌格式的固定值",
      "disposition": "candidate",
      "consumers": [
        "local"
      ],
      "flags": "",
      "pattern": "\\bgh[pousr]_[A-Za-z0-9]{20,}\\b"
    },
    {
      "id": "QINDUN.D5.OPENAI_KEY",
      "version": "1.0.0",
      "dimension": "D5",
      "severity": "high",
      "title": "发现疑似 OpenAI 接口密钥",
      "summary": "内容包含符合 OpenAI 接口密钥格式的固定值",
      "disposition": "candidate",
      "consumers": [
        "local"
      ],
      "flags": "",
      "pattern": "\\bsk-(?:proj-)?[A-Za-z0-9_-]{20,}\\b"
    },
    {
      "id": "QINDUN.D5.SLACK_TOKEN",
      "version": "1.0.0",
      "dimension": "D5",
      "severity": "high",
      "title": "发现疑似 Slack 访问令牌",
      "summary": "内容包含符合 Slack 令牌格式的固定值",
      "disposition": "candidate",
      "consumers": [
        "local"
      ],
      "flags": "",
      "pattern": "\\bxox[baprs]-[A-Za-z0-9-]{20,}\\b"
    },
    {
      "id": "QINDUN.D5.JWT",
      "version": "1.0.0",
      "dimension": "D5",
      "severity": "high",
      "title": "发现疑似固定 JWT 令牌",
      "summary": "内容包含由三段编码组成的固定 JWT 令牌",
      "disposition": "candidate",
      "consumers": [
        "local"
      ],
      "flags": "",
      "pattern": "\\beyJ[A-Za-z0-9_-]{10,}\\.[A-Za-z0-9_-]{10,}\\.[A-Za-z0-9_-]{10,}\\b"
    },
    {
      "id": "QINDUN.D6.OBFUSCATED_NETWORK",
      "version": "1.0.0",
      "dimension": "D6",
      "severity": "medium",
      "title": "发现可能隐藏网络目标的动态解码",
      "summary": "内容在网络调用附近动态解码数据，需要进一步复核数据流",
      "disposition": "candidate",
      "consumers": [
        "local"
      ],
      "flags": "IGNORECASE|DOTALL",
      "pattern": "(?:base64\\.b64decode|atob\\s*\\(|Buffer\\.from\\().{0,300}(?:http|socket|request|fetch)"
    },
    {
      "id": "QINDUN.D6.HARDCODED_SOCKET_TARGET",
      "version": "1.0.0",
      "dimension": "D6",
      "severity": "medium",
      "title": "发现硬编码套接字网络目标",
      "summary": "代码直接连接固定 IP 和端口，需要确认是否属于声明能力",
      "disposition": "candidate",
      "consumers": [
        "local"
      ],
      "flags": "IGNORECASE",
      "pattern": "(?:socket\\.create_connection|socket\\.connect|net\\.connect)\\s*\\(\\s*\\(?\\s*[\"'](?:\\d{1,3}\\.){3}\\d{1,3}[\"']\\s*,\\s*\\d{1,5}"
    },
    {
      "id": "QINDUN.D3.AGENT_CONTEXT_WRITE",
      "version": "1.0.0",
      "dimension": "D3",
      "severity": "high",
      "title": "发现智能体上下文写入行为",
      "summary": "代码可能修改智能体记忆、系统说明、设置或钩子文件，需要核对作品用途",
      "disposition": "candidate",
      "consumers": [
        "platform",
        "local"
      ],
      "flags": "IGNORECASE|DOTALL",
      "pattern": "(?:(?:MEMORY\\.md|CLAUDE\\.md|\\.claude/(?:memory|settings|hooks)).{0,180}(?:write_text|writeFile|appendFile|open\\([^\\n]{0,80}[\"']a?[w+][\"']|tee\\b)|(?:write_text|writeFile|appendFile|tee\\b).{0,180}(?:MEMORY\\.md|CLAUDE\\.md|\\.claude/(?:memory|settings|hooks)))"
    },
    {
      "id": "QINDUN.D3.SHELL_PROFILE_WRITE",
      "version": "1.0.0",
      "dimension": "D3",
      "severity": "high",
      "title": "发现命令解释器启动文件写入行为",